Rank,Team,GP,W,D,L,GF,GA,GD,Pts,PPG,StrengthIndex
1,NKY Gunners Athletic Club NKY Gunners Athletic Club B17,8,8,0,0,44.0,4.0,40.0,24,3.0,100.0
2,Lord's Gym Price Hill F.C. B17/18,6,5,0,1,26.0,10.0,16.0,15,2.5,81.3
3,Fairfield Optimist Soccer Club FOSC B17 Red,8,6,0,2,29.0,20.0,9.0,18,2.25,82.5
4,Total Futbol Academy(OH) TFA B17 Elite,8,6,0,2,40.0,24.0,16.0,18,2.25,73.5
5,Springfield Thunder SC Navy B2017,7,5,0,2,0.0,0.0,0.0,15,2.14,64.9
6,Cincinnati Elite FC Cincinnati Elite FC B17 Elite,7,2,5,0,20.0,18.0,2.0,11,1.5714285714285714,57.7
7,Cincy SC Cincy SC B17 Elite,8,4,0,4,26.0,34.0,-8.0,12,1.5,35.0
8,Troy Rattlers B17/18,8,3,1,4,0.0,0.0,0.0,10,1.25,44.2
9,Mercury Mercury B17 Red,8,0,2,6,8.0,40.0,-32.0,2,0.25,8.8
